Name	title	coding
t3_qnfh8q	caged squirrel in leacock I'd like to know if it's ok	o
t3_qmsx3x	atm near campus	o
t3_qmlgoo	Flex-Spaces - Fall 2021 - Recommendation	o
t3_qphe5x	Starting a band	o
t3_qpkl4v	what is this about? seems sus	o
t3_qov9br	Winter term at Udem?	c
t3_qo9l6v	Is Submitting a Final Exam Paper to a Journal Problematic?	o
t3_qod30w	Where to buy Honeycomb?	o
t3_qmlasv	"Ashamed of your last-minute Halloween costume this year? Start planning early for next year, and dress up as an undergrad Science student."	o
t3_qo1vab	Winter 2022 Exchange Reinstatement: Australia	o
t3_qp3xao	"To full time students/part time workers in the Life Sciences program, what should be the maximum amount of hours you allot for work without compromising your studies??"	o
t3_qmndra	Comment on OSD exams?	c
t3_qp87j2	On-campus study spots with nice outside view ?	o
t3_qmvj56	course equivalency	c
t3_qp5rs9	COMP 252	c
t3_qphp3l	Hot chocolate	f
t3_qnotut	Positive COVID Case at CHEM 222 midterm 2/Lab	o
t3_qo5qd4	Cat chasing birds outside of McConnell today (what should we name them?)	o
t3_qpo74y	Grading at McGill	c
t3_qpeplw	In-person final exams set in stone?	c
t3_qnnvxb	Watching UFC Events Near Campus	o
t3_qmim0k	Guy on Sherbrooke asking for Money	o
t3_qou8zc	fall 2021 SSMU referendum starts tomorrow!	o
t3_qn2sji	REAL TALK FRIDAY	o
t3_qpd7vg	Is there free COVID testing for McGill students?	o
t3_qnqqcq	Good complementary classes with no essays (engineering)	c
t3_qplrde	Comp 598 students: Should res provide better vegetarian food options?	f
t3_qos56x	Quick SOCI235 Questions	c
t3_qnevrn	Need recommendations for interview tips	o
t3_qorssr	Is it cold on campus today?	o
t3_qph27r	Struggling with Language at Work	o
t3_qmxg3q	seeing a dermatologist as an intl student	o
t3_qpdtsm	International student insurance coverage for consultation with a doctor outside McGill	o
t3_qphbd3	DONE WITH HEALTH SERVICES	o
t3_qp2flr	Was Just Informed that I am not Going to Make it in the Workforce	o
t3_qpjb3c	Which advisor should I contact to talk about switching faculties?	c
t3_qpishs	Fast pass sticker??	o
t3_qnqo17	Nail places downtown??	o
t3_qncn98	Anyone know any good psychoanalysts around?	o
t3_qn8xww	Hot water on campus?	f
t3_qocst2	"SSMU Dental Insurance maxed out, what should I do"	o
t3_qnrj9f	textbook requirements for poli classes?	c
t3_qnowoj	UPDATE: KEYS FOUND!!!	o
t3_qpo7rn	Harassed on the metro	o
t3_qmslx9	Where can I find a poppy? (2021)	o
t3_qmtz2g	MGCR 341 midterm location	c
t3_qnm80d	birth control @ wellness hub	o
t3_qovae6	Where to apply for summer internships CS?	o
t3_qnosog	Anyone been to Gerts bar recently?	f
t3_qp0a8e	Anyone willing to share psyc 213 notes?	c